{"$schema":"https://json-schema.org/draft/2020-12/schema","type":"object","required":["schema_version","parameter_space_id","search_method","parameters"],"properties":{"schema_version":{"const":"native-parameter-space/1.0"},"parameter_space_id":{"type":"string"},"search_method":{"enum":["grid_search","coordinate_search","bounded_random_search"]},"parameters":{"type":"array","minItems":1}},"additionalProperties":false}
